{
  "schemaVersion": 3,
  "chainId": 4663,
  "dropId": "0x228d60bc223a8aa359e831bb7dc8173f2f949cf4df35547c66d5c0ee270c0c5f",
  "rewardAsset": {
    "tokenAddress": "0x4EA005168D7F09a7A0Ba9D1DEf21a479950E44C2",
    "distributorAddress": "0x00000000000000000000000000000000000000b2",
    "symbol": "COST",
    "name": "Costco Robinhood Stock Token",
    "decimals": 18
  },
  "assetContextHash": "0xdffaa7c3b439e0df7b98b5953e51e50fdcb598deed740ffa2edf901eccc65596",
  "holderSnapshotHash": "0x255e83efd9b51e1a650a7a8907b4d81a368011a2eb5686c219ec8c2222d7520a",
  "holderSnapshot": [
    {
      "address": "0x00000000000000000000000000000000000000A1",
      "minimumBalance": "100",
      "streak": 1,
      "excluded": false
    },
    {
      "address": "0x00000000000000000000000000000000000000C3",
      "minimumBalance": "100",
      "streak": 2,
      "excluded": false
    }
  ],
  "window": {
    "sequence": 1,
    "startBlock": "100",
    "endBlock": "200",
    "rulesVersion": "1.0.0",
    "rulesPath": "rules/RULES-v1.md",
    "rulesSha256": "b80cc1e93fac35292aa1bce7beb537e4cd5f181260d3f35d01889a4dfbc797b9"
  },
  "rewardAmount": "101",
  "floorTokenAmount": "50",
  "eligibleCount": 2,
  "totalWeight": "215",
  "allocationRoot": "0x2e7bb9e7c5a5ed53eb9a5d89c1a486765ed2c6d4ff38151ce5cb2356ef8f5d84",
  "batchesRoot": "0xf73542f8b36fdaba48e33d84ec88bebbcdb01a8aaf8d85a67821be8eff8c7e15",
  "expectedBatches": 1,
  "safeCreateDropCalldata": "0x183ec146228d60bc223a8aa359e831bb7dc8173f2f949cf4df35547c66d5c0ee270c0c5f2e7bb9e7c5a5ed53eb9a5d89c1a486765ed2c6d4ff38151ce5cb2356ef8f5d84f73542f8b36fdaba48e33d84ec88bebbcdb01a8aaf8d85a67821be8eff8c7e1500000000000000000000000000000000000000000000000000000000000000650000000000000000000000000000000000000000000000000000000000000001",
  "safeFinalizeDropCalldata": "0xd1ffe590228d60bc223a8aa359e831bb7dc8173f2f949cf4df35547c66d5c0ee270c0c5f",
  "safeCreateDropTransaction": {
    "to": "0x00000000000000000000000000000000000000b2",
    "value": "0",
    "data": "0x183ec146228d60bc223a8aa359e831bb7dc8173f2f949cf4df35547c66d5c0ee270c0c5f2e7bb9e7c5a5ed53eb9a5d89c1a486765ed2c6d4ff38151ce5cb2356ef8f5d84f73542f8b36fdaba48e33d84ec88bebbcdb01a8aaf8d85a67821be8eff8c7e1500000000000000000000000000000000000000000000000000000000000000650000000000000000000000000000000000000000000000000000000000000001"
  },
  "safeFinalizeDropTransaction": {
    "to": "0x00000000000000000000000000000000000000b2",
    "value": "0",
    "data": "0xd1ffe590228d60bc223a8aa359e831bb7dc8173f2f949cf4df35547c66d5c0ee270c0c5f"
  },
  "allocations": [
    {
      "address": "0x00000000000000000000000000000000000000A1",
      "minimumBalance": "100",
      "streak": 1,
      "multiplierBps": "10000",
      "weight": "100",
      "amount": "47",
      "leaf": "0xd3e286b8e83cf57d1fa7415628a40c28ef9e16a09c5227b31a4f0025f3e53111",
      "proof": [
        "0xcb0aff2c61538ee24784bddebcfb0547ec0a2b4a76c9edf5ba056a14b15984c2"
      ]
    },
    {
      "address": "0x00000000000000000000000000000000000000C3",
      "minimumBalance": "100",
      "streak": 2,
      "multiplierBps": "11500",
      "weight": "115",
      "amount": "54",
      "leaf": "0xcb0aff2c61538ee24784bddebcfb0547ec0a2b4a76c9edf5ba056a14b15984c2",
      "proof": [
        "0xd3e286b8e83cf57d1fa7415628a40c28ef9e16a09c5227b31a4f0025f3e53111"
      ]
    }
  ],
  "batches": [
    {
      "index": 0,
      "recipients": [
        "0x00000000000000000000000000000000000000A1",
        "0x00000000000000000000000000000000000000C3"
      ],
      "amounts": [
        "47",
        "54"
      ],
      "batchHash": "0x93ca5331de4e8e3c514bb5a9bbb795af28fe3980fd9eb854ede365b95d59c13c",
      "leaf": "0xf73542f8b36fdaba48e33d84ec88bebbcdb01a8aaf8d85a67821be8eff8c7e15",
      "proof": [],
      "operatorCalldata": "0x01baf727228d60bc223a8aa359e831bb7dc8173f2f949cf4df35547c66d5c0ee270c0c5f000000000000000000000000000000000000000000000000000000000000000000000000000000000000000000000000000000000000000000000000000000a000000000000000000000000000000000000000000000000000000000000001000000000000000000000000000000000000000000000000000000000000000160000000000000000000000000000000000000000000000000000000000000000200000000000000000000000000000000000000000000000000000000000000a100000000000000000000000000000000000000000000000000000000000000c30000000000000000000000000000000000000000000000000000000000000002000000000000000000000000000000000000000000000000000000000000002f00000000000000000000000000000000000000000000000000000000000000360000000000000000000000000000000000000000000000000000000000000000",
      "operatorTransaction": {
        "to": "0x00000000000000000000000000000000000000b2",
        "value": "0",
        "data": "0x01baf727228d60bc223a8aa359e831bb7dc8173f2f949cf4df35547c66d5c0ee270c0c5f000000000000000000000000000000000000000000000000000000000000000000000000000000000000000000000000000000000000000000000000000000a000000000000000000000000000000000000000000000000000000000000001000000000000000000000000000000000000000000000000000000000000000160000000000000000000000000000000000000000000000000000000000000000200000000000000000000000000000000000000000000000000000000000000a100000000000000000000000000000000000000000000000000000000000000c30000000000000000000000000000000000000000000000000000000000000002000000000000000000000000000000000000000000000000000000000000002f00000000000000000000000000000000000000000000000000000000000000360000000000000000000000000000000000000000000000000000000000000000"
      }
    }
  ]
}
